Sat Dec 16 04:50:31 +0000 2017,"Lagos, Nigeria",,": Without Health for All, We Will Not End Poverty by We are at a critical turning poin"
Sat Dec 16 04:50:34 +0000 2017,"Miami, FL",,": / The resurgence of debtors prisons across US entraps poor people, too many of whom"
Sat Dec 16 04:50:34 +0000 2017,"Washington, USA",,: sitting in a mansion...and this poor kid abt to enter the
Sat Dec 16 04:50:35 +0000 2017,seattle,,IM SO SORRY TO EVERYONE WHO WILL WAKE UP WITH NOTIFS WHEN YOURE PLAYING HUNGER GAMES IT JUST BE LIKE THAT
Sat Dec 16 04:50:37 +0000 2017,Houston,,Hunger pangs?
Sat Dec 16 04:50:37 +0000 2017,Denial,,: hello poors I know u want jobs and healthcare but Im here to tell you theres a better way hear me out imagina
Sat Dec 16 04:50:38 +0000 2017,"Amsterdam, The Netherlands",,: Money was always a poor substitute for the synchronicity our collective unconscious. solves the legacy iss
Sat Dec 16 04:50:38 +0000 2017,South Africa,,": ""I'm gay and wanna be able to get married in peace...but I still hate poor people. ...I could also do without the"
Sat Dec 16 04:50:39 +0000 2017,"victoria, bc",,This is a mother fucking clear case of :hunger versus well fed. He's still the man. Iconic.
Sat Dec 16 04:50:41 +0000 2017,"Atlanta, GA",,": The truly rich have managed to pit the poor against the working class, the working class against the m"
Sat Dec 16 04:50:41 +0000 2017,Canada,,Point of View Numbskull...POTUS...Poor Omarosa...Guilty by Ass..o..ciation..? Blacklashed..?
Sat Dec 16 04:50:42 +0000 2017," 
",,: can yall stop actin like the internet made everyone antisocial. get off ur phone if u wanna connect physically but
Sat Dec 16 04:50:45 +0000 2017,Greensboro/Charlotte,,"Whew, I must be missing something there. Ketamine is basically the poor folk's version of MDMA/Bath Salts down here in NC."
Sat Dec 16 04:50:47 +0000 2017,"Maine, USA",,: Go out of donating to with raising $1M to end world hunger
Sat Dec 16 04:50:48 +0000 2017,"South Norwood, UK",,Imagination is a poor matter when it has to part company with understanding.
Sat Dec 16 04:50:48 +0000 2017, Politically Correct Australia,,"Poor old Santa, or any snow for that matter"
Sat Dec 16 04:50:51 +0000 2017,India,,: Bail-in using poor depositors' funds. What happens to borrowers and bank managements? Go scot free. Private profits
Sat Dec 16 04:50:54 +0000 2017,Atlanta GA ,,: FCC Makes Internet Harder for Poor People to Access | via TheDailyBeast
Sat Dec 16 04:50:59 +0000 2017,"Pittsburgh, PA",,THE POOR BABE AWE 0
Sat Dec 16 04:51:01 +0000 2017,"Bowmanville, On, Canada",,: FCC Makes Internet Harder for Poor People to Access | via TheDailyBeast
Sat Dec 16 04:51:04 +0000 2017,"Almere, Netherlands",,Assessing the impact of poor data on retail: The -10-100 rule 8 9
Sat Dec 16 04:51:06 +0000 2017,Philadelphia PA.,,: Why are black people poor? via
Sat Dec 16 04:51:06 +0000 2017,anywhere the wind blows,,It was never really about abortion. It's all about making sure the poor stay poor.
Sat Dec 16 04:51:07 +0000 2017,"Pennsylvania, USA",,Will be following up on this poor boys journey and plight. He arrived from the racetrack today from Mario... 9
Sat Dec 16 04:51:07 +0000 2017,England,,: Poor Iain didn't see all the whisperings behind his back though.... grrrr....
Sat Dec 16 04:51:07 +0000 2017,New York,,My friend with piss poor timing snapped this gem yesterday.
Sat Dec 16 04:51:08 +0000 2017,Indonesia,,": Rich Man, Poor Woman : Seorang CEO di perusahaan IT, Next One. Dia sombong dan tidak mudah percaya orang lain. Keku"
Sat Dec 16 04:51:09 +0000 2017,Anywhere But Here!!!,,: FCC Makes Internet Harder for Poor People to Access | via TheDailyBeast
Sat Dec 16 04:51:09 +0000 2017,"California, USA",,: Poor Tidus.
Sat Dec 16 04:51:09 +0000 2017,,Texas,: poor officer in El Paso Texas she is having a very busy nite lol!
Sat Dec 16 04:51:10 +0000 2017,At my function,,no fuck you this is literally your own fault. empty the tanks and stop fucking treating these poor endang
Sat Dec 16 04:51:11 +0000 2017,"New South Wales, Australia",,: WHO WILL PROTECT THE POOR LITTLE BUZZFEEDERS?
Sat Dec 16 04:51:12 +0000 2017,"Hampton, VA",,": Look folks, just because we hate Donald Trump, doesnt mean we like poor people!!! -Senators Jeff Flake and John"
Sat Dec 16 04:51:12 +0000 2017,"Madhya Pradesh, India",India,": With schemes like Jan Dhan Yojana, Skill India, BJP Guj has been working for empowerment of poor sections of society"
Sat Dec 16 04:51:13 +0000 2017,Zuunmod Mongolia,,"You're assuming the fiscally responsible States are impoverished. Alternative view, they cut back the fede"
Sat Dec 16 04:51:13 +0000 2017,Bellevue,,"Info: is known treating , , bites, , poor circulation and :"
Sat Dec 16 04:51:14 +0000 2017,Ontario,,I'm going with agenda and piss poor writing. U2
Sat Dec 16 04:51:16 +0000 2017,"Bronx, NY",,: Money was always a poor substitute for the synchronicity our collective unconscious. solves the legacy iss
Sat Dec 16 04:51:16 +0000 2017,"Morris, IL",,Roy needs to get on his horse & ride off into the sunset. Tho I do feel bad for the poor horse. Maybe he c
Sat Dec 16 04:51:17 +0000 2017,"California, USA",,I don't even know if my poor laptop can handle it
Sat Dec 16 04:51:19 +0000 2017,do not own content posted,,: rt if you're poor
Sat Dec 16 04:51:19 +0000 2017,"Oklahoma City, OK",,YOU DONT MAKE FUN OF THE FUTURE MVP LIKE THAT!!!!!!!! THE MAN MAKES UP FOR HIS POOR FREE THROW WITH BEI
Sat Dec 16 04:51:20 +0000 2017,Behind Enemy Lines Commie CA,,: So Much for Peace Between Arabs and Jews: The Arab Governments Won't Have It! Poor Iraqi Girl Thrown out of Country
Sat Dec 16 04:51:20 +0000 2017,New Delhi,Rajasthan,": Plz sign this petition to stop Rajasthan govt's inhuman act against Sri Shambhulal Regar's wife, a poor dalit woman"
Sat Dec 16 04:51:21 +0000 2017,"Seattle, WA ",,"My poor dad lol. His brothers, my mom and step mom never let it go lol. I still subconsciously say it too"
Sat Dec 16 04:51:24 +0000 2017,"Huddersfield, UK",,: Yet to see millions of British people die in a horrendous famine but sure
Sat Dec 16 04:51:24 +0000 2017,"San Diego, CA",,: hello poors I know u want jobs and healthcare but Im here to tell you theres a better way hear me out imagina
Sat Dec 16 04:51:24 +0000 2017,Kenya,,"Women are times more likely than men to report lack of skills as a barrier to Internet use, while one gigabyte"
Sat Dec 16 04:51:24 +0000 2017,Liverpool,,: hello poors I know u want jobs and healthcare but Im here to tell you theres a better way hear me out imagina
Sat Dec 16 04:51:25 +0000 2017,"California, USA",,: The pending tax bill is basically Republican piggery; another case of the rich man dancing while the poor man pays the ban
Sat Dec 16 04:51:26 +0000 2017,"Kansas City, MO",,"Poor Sassy!! Seriously, this guy is eecting a red carpet like a bumbling idiot!!"
Sat Dec 16 04:51:26 +0000 2017,"Ballston Spa, NY",,: this is literally abuse and all this does is set the poor kid up to be bullied. a lot of y'all really don't deserve
Sat Dec 16 04:51:29 +0000 2017,sharm ,,'Despair in their eyes': Hunger waits at the doors of Damascus as Assad blocks aid
Sat Dec 16 04:51:31 +0000 2017,Bungou game is here,,My poor weak pure team failed me yet again I had fun playing w u
Sat Dec 16 04:51:31 +0000 2017,The Great United States,,Obviously you don't know who you're talking to. Anecdotes are a poor argument. Social service
Sat Dec 16 04:51:32 +0000 2017,"Bloomington, IN",,Little Rubio asking for a little handout for the poor folk. Too bad well spend it all on half a familys trip to t
Sat Dec 16 04:51:32 +0000 2017,"Bay Area, CA",,(it's john/the hunger so there's some body/eye horror but) THIS IS SUCH A COOL COSPLAY??? HO
Sat Dec 16 04:51:34 +0000 2017,"cv, ph",,: : Her exquisite ball gown is crimson with the blood of the poor.
Sat Dec 16 04:51:34 +0000 2017,Port Elizabeth-SA,,": Jesus said to them, ""I am the bread of life; he who comes to Me will not hunger, and he who believes in Me will never"
Sat Dec 16 04:51:36 +0000 2017,+60,,cosmic heart seasons greetings from sugarrush is so pretty why am i poor
Sat Dec 16 04:51:38 +0000 2017,"Indiana, USA",,: Sore losers also tend to be poor winners. The attitude of the heart is still the same whether the outcome is favora
Sat Dec 16 04:51:38 +0000 2017,behind the denny's dumpster,,": If socialists wanted to help the poor so much, why didn't they retweet Money Cat in seconds , rather than whine about dive"
Sat Dec 16 04:51:38 +0000 2017,sharm ,,: 'Despair in their eyes': Hunger waits at the doors of Damascus as Assad blocks aid 0
Sat Dec 16 04:51:39 +0000 2017,usa,,"Leave Sassy out of this, poor Sassy. He can run...Run Moore, Run."
Sat Dec 16 04:51:40 +0000 2017,"Kannauj, India",,": Shrinkala, Lakshya, Simran and Samikshaa just grabbed a hunger bar and gave the Snickers of the Year award to their"
Sat Dec 16 04:51:42 +0000 2017,"Seattle, WA",,Ugghhh!!!!!!!!! You poor thing! I am so sorry!
Sat Dec 16 04:51:43 +0000 2017,minneapolis,,poor girl acts her absolute heart out.
Sat Dec 16 04:51:45 +0000 2017,"Russellville, AR",,I want to give a special thanks to for unsurprisingly turning his back on the middle and poor classes a
Sat Dec 16 04:51:45 +0000 2017,uconn ,,: i cannot vibe or associate with people who have the poor me victim mentality. not because they are any less beaut
Sat Dec 16 04:51:45 +0000 2017,#DDD,,you all a poor excuse for an airline. Sat in this dumb plant for hours just got you all to cancel the flight
Sat Dec 16 04:51:48 +0000 2017,161205,,: no of fence but why do paid school field trips still exist in this day and age why do teachers hate their poor students
Sat Dec 16 04:51:50 +0000 2017,whalien 52 mv ,,": It's not that the photoshoot of Isabelle Duterte is illegal, it's just that rn, the poor are getting visibly poorer"
Sat Dec 16 04:51:50 +0000 2017,"Ngerulmud, Palau",,Bastard ! Poor kittens RIP
Sat Dec 16 04:51:52 +0000 2017,Unceded Coast Salish Land YYJ,,I understand healthcare and education will take a long time to fix. Regulato
Sat Dec 16 04:51:55 +0000 2017,"California, USA",,": /\ Raising wage to $15 is a bad idea > suffer, class gap widens, increases. https://t."
Sat Dec 16 04:51:55 +0000 2017,USA,,: So Much for Peace Between Arabs and Jews: The Arab Governments Won't Have It! Poor Iraqi Girl Thrown out of Country
Sat Dec 16 04:51:57 +0000 2017,Somewhere Out There,,: A UN eert on deprivation wants to know why MILLION Americans are living in poverty. Also fact: U.S. has more
Sat Dec 16 04:51:58 +0000 2017,southern Calif. (NO DMs),,Our fever our hunger is now a wildfire out of control desire's flames licking our erotic imaginations as we ache
Sat Dec 16 04:51:58 +0000 2017,Los Angeles,,: Slipping in another TLJ viewing so my poor kid doesnt have to wait till the rd. Seemed too cruel. But its a :05 am sho
Sat Dec 16 04:52:04 +0000 2017,"Gillette, WY",,u poor thing
Sat Dec 16 04:52:06 +0000 2017,"Ahmadabad City, India",,"Ya phir ""I don't have a sweet tooth!"" Poor girl is sent loads of sweets!"
Sat Dec 16 04:52:09 +0000 2017,stone mountain ga,,a poor gay means that you poor to lol
Sat Dec 16 04:52:11 +0000 2017,kofuku.,,"poor jiwoo, you have me."
Sat Dec 16 04:52:12 +0000 2017,"California, USA",,": DREAMers in custody, refusing to give their names to police & going on hunger strike. With repealed, there'"
Sat Dec 16 04:52:14 +0000 2017,Central City,,: I don't care about The Last Jedi being bad or good but it looks like the film is becoming divisive among the fans d
Sat Dec 16 04:52:15 +0000 2017,"Vancouver, BC",,Tiki Barber is a poor substitute for Terry Crews.
Sat Dec 16 04:52:16 +0000 2017,gay,,still doesn't excuse their poor narrative/direction/plot choices but it does lend some context
Sat Dec 16 04:52:16 +0000 2017,"Detroit, MI",,": Chris Rock: 'If Poor People Knew How Rich Rich People Are, There Would Be Riots' | HuffPost"
Sat Dec 16 04:52:16 +0000 2017,Earth,,Poor blocked Rocky.
Sat Dec 16 04:52:17 +0000 2017,"Niedersachsen, Deutschland",,Ich habe Hunger auf gebratene Nudeln mit Hhnchenfleisch. JETZT!
Sat Dec 16 04:52:19 +0000 2017,My Dream,,": I come from a low income family, I arrived on campus with just $120.00 in my pocket. First year, I was on acade"
Sat Dec 16 04:52:21 +0000 2017,"Los Angeles, CA",,": We need to see poor people as people who deserve to live in dignity, who should be taken under the wing of the stat"
Sat Dec 16 04:52:24 +0000 2017,"Nacogdoches, TX",,: The pending tax bill is basically Republican piggery; another case of the rich man dancing while the poor man pays the ban
Sat Dec 16 04:52:24 +0000 2017,Charlottesville,,: It looks like environmental degradation and poverty are what is making America exceptional these days. Some of th
Sat Dec 16 04:52:25 +0000 2017,Seattle,,Ough this poor mother
Sat Dec 16 04:52:26 +0000 2017,United States,,: Poor blocked Rocky.
Sat Dec 16 04:52:28 +0000 2017,"Noti's On, RT's Off",,": I come from a low income family, I arrived on campus with just $120.00 in my pocket. First year, I was on acade"
Sat Dec 16 04:52:28 +0000 2017,"Boston, MA",,": I come from a low income family, I arrived on campus with just $120.00 in my pocket. First year, I was on acade"
Sat Dec 16 04:52:28 +0000 2017,"Detroit, MI",,": I come from a low income family, I arrived on campus with just $120.00 in my pocket. First year, I was on acade"
Sat Dec 16 04:52:28 +0000 2017,"Miami, FL, USA",,": I come from a low income family, I arrived on campus with just $120.00 in my pocket. First year, I was on acade"
Sat Dec 16 04:52:28 +0000 2017,"Newark, NJ",,": I come from a low income family, I arrived on campus with just $120.00 in my pocket. First year, I was on acade"
Sat Dec 16 04:52:28 +0000 2017,"Greenville, NC, USA",,": I come from a low income family, I arrived on campus with just $120.00 in my pocket. First year, I was on acade"
Sat Dec 16 04:52:28 +0000 2017,East Coast,,": I come from a low income family, I arrived on campus with just $120.00 in my pocket. First year, I was on acade"
Sat Dec 16 04:52:28 +0000 2017,United States,,": I come from a low income family, I arrived on campus with just $120.00 in my pocket. First year, I was on acade"
Sat Dec 16 04:52:28 +0000 2017,On The Moon ,,": I come from a low income family, I arrived on campus with just $120.00 in my pocket. First year, I was on acade"
Sat Dec 16 04:52:28 +0000 2017,"Pennsylvania, USA",,": I come from a low income family, I arrived on campus with just $120.00 in my pocket. First year, I was on acade"
Sat Dec 16 04:52:28 +0000 2017,"Des Moines, IA",,": I come from a low income family, I arrived on campus with just $120.00 in my pocket. First year, I was on acade"
Sat Dec 16 04:52:28 +0000 2017,"Detroit, MI",,": I come from a low income family, I arrived on campus with just $120.00 in my pocket. First year, I was on acade"
Sat Dec 16 04:52:28 +0000 2017,On Your Mind,,": I come from a low income family, I arrived on campus with just $120.00 in my pocket. First year, I was on acade"
Sat Dec 16 04:52:28 +0000 2017,"California, USA",,": I come from a low income family, I arrived on campus with just $120.00 in my pocket. First year, I was on acade"
Sat Dec 16 04:52:28 +0000 2017,"Lawrence, Kansas",,": I come from a low income family, I arrived on campus with just $120.00 in my pocket. First year, I was on acade"
Sat Dec 16 04:52:28 +0000 2017,"Boston, MA",,": I come from a low income family, I arrived on campus with just $120.00 in my pocket. First year, I was on acade"
Sat Dec 16 04:52:28 +0000 2017,Cloud 9,,": I come from a low income family, I arrived on campus with just $120.00 in my pocket. First year, I was on acade"
Sat Dec 16 04:52:28 +0000 2017,Neverland Ranch,,": I come from a low income family, I arrived on campus with just $120.00 in my pocket. First year, I was on acade"
Sat Dec 16 04:52:28 +0000 2017,Texas,,": I come from a low income family, I arrived on campus with just $120.00 in my pocket. First year, I was on acade"
Sat Dec 16 04:52:28 +0000 2017,"Mississippi, USA",,": I come from a low income family, I arrived on campus with just $120.00 in my pocket. First year, I was on acade"
Sat Dec 16 04:52:28 +0000 2017,Worldwide,,": I come from a low income family, I arrived on campus with just $120.00 in my pocket. First year, I was on acade"
Sat Dec 16 04:52:28 +0000 2017,Universal,,": I come from a low income family, I arrived on campus with just $120.00 in my pocket. First year, I was on acade"
Sat Dec 16 04:52:28 +0000 2017,"Detroit, MI",,": I come from a low income family, I arrived on campus with just $120.00 in my pocket. First year, I was on acade"
Sat Dec 16 04:52:28 +0000 2017,turn on notifs,,": I come from a low income family, I arrived on campus with just $120.00 in my pocket. First year, I was on acade"
Sat Dec 16 04:52:28 +0000 2017,La La Land,,": I come from a low income family, I arrived on campus with just $120.00 in my pocket. First year, I was on acade"
Sat Dec 16 04:52:28 +0000 2017,United States,,": I come from a low income family, I arrived on campus with just $120.00 in my pocket. First year, I was on acade"
Sat Dec 16 04:52:28 +0000 2017,"Georgia, USA",,": I come from a low income family, I arrived on campus with just $120.00 in my pocket. First year, I was on acade"
Sat Dec 16 04:52:28 +0000 2017,United States,,": I come from a low income family, I arrived on campus with just $120.00 in my pocket. First year, I was on acade"
Sat Dec 16 04:52:28 +0000 2017,Papertrail,,": I come from a low income family, I arrived on campus with just $120.00 in my pocket. First year, I was on acade"
Sat Dec 16 04:52:29 +0000 2017,"Houston, TX",,"Essentially if you break the law you go to jail, if he didnt want to get arrested shouldve sold his brownies some"
Sat Dec 16 04:52:32 +0000 2017,"Dar es Salaam, Tanzania",,: rt if you're poor
Sat Dec 16 04:52:34 +0000 2017,Washington state,,: Nearly million veterans received Social Security Disability Insurance benefits in but Trump wants to add mor
Sat Dec 16 04:52:36 +0000 2017,seattle,,Noa's Hunger Games- Part ! Who will make it out alive today?!? 8
Sat Dec 16 04:52:43 +0000 2017,Arctic Northwest,,"Yep, I worked my whole life and the Libs want me to work more to support their poor choices"
Sat Dec 16 04:52:48 +0000 2017,Everywhere marketers are.,,Assessing the impact of poor data on retail: The -10-100 rule by
Sat Dec 16 04:52:48 +0000 2017,"Yonkers, NY",,: trigger warning!!! this is abuse. this is degrading. this is next level fucked up shit. and that poor boy is fucki
Sat Dec 16 04:52:49 +0000 2017,"Brisbane, Australia",,"Jesus, it looks like half of the countries politicians are in today. You poor poor bastards"
Sat Dec 16 04:52:50 +0000 2017,East of Eden,,: The pending tax bill is basically Republican piggery; another case of the rich man dancing while the poor man pays the ban
Sat Dec 16 04:52:53 +0000 2017,Kazakhstan,,Poor Hats off to
Sat Dec 16 04:52:55 +0000 2017,Philippines,,Poor little girls!
Sat Dec 16 04:52:55 +0000 2017,PonyVille,,If the fcc gets their way and ittl cost money to use twitter I'll have to leave it forever cause I'm poor and I hav u
Sat Dec 16 04:52:56 +0000 2017,"Birmingham, MI",,": Unlike the hero of a familiar classic story, the GOP steals from the middle class and poor to give t"
Sat Dec 16 04:52:57 +0000 2017,"Rosamond, CA",,": So donate more of your money to the federal government, you greedy miser."
Sat Dec 16 04:52:57 +0000 2017,Colorado,,": Trump bans any mention of facts, diversity, or being poor at government agency via"
Sat Dec 16 04:52:58 +0000 2017,Everywhere,,...unemployment and hunger rate by unfriendly policies. A shut down business cannot pay tax arrears. Reach a compromise
Sat Dec 16 04:52:58 +0000 2017,FUB Free,,: poor guy..like we all joke about whaling but. gamblings a serious addiction even if its a gacha game d
Sat Dec 16 04:53:01 +0000 2017,TBL  ,,poor mikey I've always been scared of the slight age bias
Sat Dec 16 04:53:02 +0000 2017,"Tennessee, USA",,I love how you always tell it like it is!!! That poor baby doesn't deserve to be bulli
Sat Dec 16 04:53:03 +0000 2017,"Maharashtra, India",,": Recently, poor poor workers were murdered in execution style killings. All were and min"
Sat Dec 16 04:53:02 +0000 2017,searching for happiness,,: : Her exquisite ball gown is crimson with the blood of the poor.
Sat Dec 16 04:53:05 +0000 2017,MOST LIKELY at a Concert,,": DREAMers in custody, refusing to give their names to police & going on hunger strike. With repealed, there'"
Sat Dec 16 04:53:06 +0000 2017,India,,Assessing the impact of poor data on retail: The -10-100 rule by addressytom
Sat Dec 16 04:53:08 +0000 2017,"Louisville, KY",,: Writing is not something people do because they looked at the world dispassionately and decided literature is what
Sat Dec 16 04:53:09 +0000 2017,"Augusta, GA",,": Lesbian, Gay, Bi, Ugly, Fine, Rich, Poor, Skinny, Fat, Short, Tall, Black, White, Purple, A FRIEND IS A FRIEND! RETWEET if y"
Sat Dec 16 04:53:10 +0000 2017,Cleveartica ,,: Trump & Republicans are a DISGRACE.1.455 Trillion added to the debt destroying the middle class and the poor. Trump
Sat Dec 16 04:53:13 +0000 2017,United States,,Assessing the impact of poor data on retail: The -10-100 rule by addressytom
Sat Dec 16 04:53:14 +0000 2017,Liberty,,: hello poors I know u want jobs and healthcare but Im here to tell you theres a better way hear me out imagina
Sat Dec 16 04:53:15 +0000 2017,Ventura Co. CA. USA,,We pay high tax in CA because of the poor leadership/management in . How the bill affects t
Sat Dec 16 04:53:16 +0000 2017,Greensboro NC,,: FCC Makes Internet Harder for Poor People to Access | via TheDailyBeast
Sat Dec 16 04:53:16 +0000 2017,"Karnataka, India",,: When we ever complain about the taste of our food remember The Beloved who used to fasten some stones on his stomach to h
Sat Dec 16 04:53:17 +0000 2017,"Indianapolis, IN",,": If socialists care about the poor, why didnt they <rolls dice> buy VR headsets instead of <rolls dice> tending org"
Sat Dec 16 04:53:19 +0000 2017,Midwest USA,,: Will be following up on this poor boys journey and plight. He arrived from the racetrack today from Mario... https://t.c
Sun Dec 17 00:26:18 +0000 2017,PalpableDiscordia,,: Spare a thought for poor Nigel. This sad man is stuck in his multimillion pound townhouse after years trapped on
Sun Dec 17 00:26:20 +0000 2017,Ireland,,Very poor performance man
Sun Dec 17 00:26:20 +0000 2017,Panopticon iMeanUr #SMARTGRID,,: Seek & you will find a reason to be offended. Poor Rudolph. 2
Sun Dec 17 00:26:20 +0000 2017,"California, USA",,: Isn't it Amazing that all we heard about from for years was the Debt? Now for people who
Sun Dec 17 00:26:20 +0000 2017,underneath the sapphire sky,,Lmao that poor attempt at an argument is like saying Nas having a flop feature last year means he was c
Sun Dec 17 00:26:21 +0000 2017,Nairobi,,: year old women who built a for poor people by selling vegetables. No treatment costs more than Rs an
Sun Dec 17 00:26:22 +0000 2017,illinois,,poor kid
Sun Dec 17 00:26:22 +0000 2017,"Saginaw,MI",,": Poor values, poor morals, poor thought processes, poor manners. Poor as fuck."
Sun Dec 17 00:26:23 +0000 2017,"Portland, OR",,": ""They've taken the black vote and the poor vote for granted for a long time. It's time for democrats to get off the"
Sun Dec 17 00:26:25 +0000 2017,New York,,: The Republican tax plan hurts: -The poor -The middle class -The sick -The disabled -The elderly It helps: -Million
Sun Dec 17 00:26:25 +0000 2017,Buffalo,,Her poor fans
Sun Dec 17 00:26:26 +0000 2017,Luxemburg,,: Poor guy DC
Sun Dec 17 00:26:26 +0000 2017,ALP Being Exposed ,,LOL That footage of John Alexander looking at Malcolm carry on like a demented plonker is priceless.
Sun Dec 17 00:26:27 +0000 2017,#blacklivesmatter,,: trump tweeting to no one after everyones too poor to pay for twitter
Sun Dec 17 00:26:30 +0000 2017,"Roseland, Florida",,"im episodes in and ) poor candace ) doofenshmirtz has ""evil"" in his company name and it just hit me and im laug 9"
Sun Dec 17 00:26:33 +0000 2017,"Cape Town, South Africa",,Long road to easy poor Refugees and Asylum seekers to travel to DRN PTA and MSN to g
Sun Dec 17 00:26:34 +0000 2017,Malaysia,,: poor guy..like we all joke about whaling but. gamblings a serious addiction even if its a gacha game d
Sun Dec 17 00:26:35 +0000 2017,Vegas,,: poor thing
Sun Dec 17 00:26:35 +0000 2017,"Mesa, AZ",,: Just saw THE LAST JEDI and it was so disappointingly poor that my wife and I have decided to go see THE DISASTER AR
Sun Dec 17 00:26:37 +0000 2017,http://www.oblicard.com/,,: North Carolina judges are all but required to impose high court fees on poor people to subsidize the retirement acc
Sun Dec 17 00:26:38 +0000 2017,"Norman, OK",,sane america has your back no daca either billion will help veterans the poor and homeless american
Sun Dec 17 00:26:38 +0000 2017,"California, USA",,This isint even enough to clean up what just happened to my poor toilet
Sun Dec 17 00:26:40 +0000 2017,love,,"i just overheard my mom asking siri ""can you dye your dog's hair?"" and ""how to dye your dog"" ..... poor tucker"
Sun Dec 17 00:26:43 +0000 2017,"Nanaimo, British Columbia",,I always want to donate to people but I'm so poor.
Sun Dec 17 00:26:46 +0000 2017,Belgium,,": Hes been terrible this season. Wasteful, poor decision making, generally bad."
Sun Dec 17 00:26:48 +0000 2017,"North Carolina, USA",,I could see the Hunger Games and Divergent existing in the same universe. That would be an epic crossover
Sun Dec 17 00:26:50 +0000 2017,South Carolina ,,: Youre an asshole. Stop attacking poor people to line the pockets of your wealthy donors. 81
Sun Dec 17 00:26:52 +0000 2017,Alaska,,Check out RICHIE RICH Poor Little Rich Boy issue lot Harvey World Comics s-80s via
